{
  "schema_version": "1",
  "slug": "echo.hosted",
  "kind": "data",
  "display_name": "Hosted Echo",
  "summary": "Echoes input via Paxeer Cloud hosted runner.",
  "tags": [
    "echo",
    "hosted"
  ],
  "owner": "0x0000000000000000000000000000000000000001",
  "payout_address": "0x0000000000000000000000000000000000000001",
  "mode": "hosted",
  "confidential": false,
  "operations": [
    {
      "name": "echo",
      "method": "POST",
      "input_schema": {
        "type": "object",
        "properties": {
          "message": {
            "type": "string"
          }
        },
        "required": [
          "message"
        ]
      },
      "output_schema": {
        "type": "object"
      },
      "timeout_ms": 5000,
      "max_response_bytes": 65536
    }
  ],
  "pricing": [
    {
      "operation": "echo",
      "model": "per_call",
      "unit": "call",
      "unit_price_usdx": "0.000200",
      "min_charge_usdx": "0.000200"
    }
  ],
  "sla": {
    "target_uptime_bps": 9900,
    "p99_latency_ms": 1200
  },
  "payee_did": "did:matrix:echo-hosted:cd8fa767b94a606c"
}
