{
  "schema_version": "1",
  "slug": "finance.rates",
  "kind": "data",
  "display_name": "FX Rates",
  "summary": "Foreign exchange spot rates and currency conversion.",
  "tags": [
    "finance",
    "fx",
    "currency"
  ],
  "owner": "0x0000000000000000000000000000000000000001",
  "payout_address": "0x0000000000000000000000000000000000000001",
  "mode": "proxy",
  "confidential": false,
  "operations": [
    {
      "name": "convert",
      "method": "POST",
      "input_schema": {
        "type": "object",
        "properties": {
          "from": {
            "type": "string"
          },
          "to": {
            "type": "string"
          },
          "amount": {
            "type": "number"
          }
        },
        "required": [
          "from",
          "to",
          "amount"
        ]
      },
      "output_schema": {
        "type": "object"
      },
      "timeout_ms": 5000
    }
  ],
  "pricing": [
    {
      "operation": "convert",
      "model": "per_call",
      "unit": "call",
      "unit_price_usdx": "0.000200",
      "min_charge_usdx": "0.000200"
    }
  ],
  "endpoint": {
    "proxy_url": "https://api.example.com/fx"
  },
  "payee_did": "did:matrix:finance-rates:2c8cc7cc02be30f8"
}
